utts	labels
Can you help me locate a place to eat tonight?	find_restaurant
I want to find a cheap restaurant in the south part of town.	find_restaurant
I need to find an expensive restaurant in the west.	find_restaurant
Are there any Chinese restaurants in the centre part of town?	find_restaurant
Are there any restaurants serving australasian food in the east part of the city?	find_restaurant
Can you help me find a restaurant in Cambridge called Loch Fyne?	find_restaurant
I am looking for information on the Yippee Noodle bar.	find_restaurant
I'm looking for a nice, expensive restaurant on the south side of town.	find_restaurant
I'm looking for a cheap restaurant in the city centre.	find_restaurant
I'm looking for a high scale chinese restaurant.	find_restaurant
I am looking for a restaurant called J Restaurant.	find_restaurant
I want a cheap restaurant in the east part of town. What is the address and postcode?	find_restaurant
Hi, I'm trying to find a restaurant called HK Fusion. What info can you get me for that?	find_restaurant
What type of food does the Oak Bistro in Cambridge serve?	find_restaurant
Hello, I am looking for a moderately priced restaurant on the east side of town.	find_restaurant
i am looking for a place to dine. The restaurant should be in the expensive price range and should serve indian food.	find_restaurant
I want to find an expensive restaurant in the east part of town.	find_restaurant
i want somewhere that serves traditional food.	find_restaurant
Can you help me find a place to have dinner?	find_restaurant
I am looking for a restaurant in West Cambridge, in the cheaper price range please.	find_restaurant
I'm looking for an expensive restaurant in the centre. Thank you.	find_restaurant
Could you help me find an expensive restaurant in the centre?	find_restaurant
I am looking for a place to dine in the centre of town	find_restaurant
I am looking for an expensive Korean restaurant. Can you tell me my options please?	find_restaurant
Are there any restaurants in town that serve modern american food?	find_restaurant
Hi. I'm trying to find a good restaurant in the south part of town.	find_restaurant
I am looking for a restaurant in the centre that serves world food.	find_restaurant
looking for mediterranean food	find_restaurant
I would like a moderately priced restaurant that serves english food	find_restaurant
I really have a craving for some good chinese food. Can you suggest a place?	find_restaurant
Hi, can you please help me find a restaurant that serves Kosher food?	find_restaurant
I really need to find a restaurant that serves modern european food. An expensive one is fine.	find_restaurant
Can you please recommend an inexpensive restaurant in the East part of town?	find_restaurant
Hello, I am looking for a Lebanese restaurant in any area. Could you please provide me with a phone number and postcode? I'm very hungry and need food!!	find_restaurant
I am looking for a restaurant in the centre in the expensive price range	find_restaurant
Indian in the north	find_restaurant
I am looking for a restaurant called lan hong house. Can you get me more information about it please?	find_restaurant
I am looking for a asian restaurant in the centre	find_restaurant
I'd like to find a Chinese restaurant in the center of town.	find_restaurant
Hello I'm looking for the shanghai family restaurant.	find_restaurant
I would like to find a cheap restaurant in the centre.	find_restaurant
Hi! Can you help me find a particular restaurant?	find_restaurant
I want a place to dine that is in the centre please.	find_restaurant
I'd like a resturant in the centre of town that serves Canapes food.	find_restaurant
I am looking for a cantonese restaurant in the north part of town.	find_restaurant
I am looking for a particular restaurant. Its name is called royal standard	find_restaurant
I want to find a restaurant serves corsica food please.	find_restaurant
Can you provide me with a great eatery in Cambridge please	find_restaurant
Hi! I am so excited to be traveling to Cambridge. Would you please help me look for a place to eat while I am there?	find_restaurant
Hi Can you help me find a restauant in the west side of the city?>	find_restaurant
I want to get a place to eat in the north.	find_restaurant
I am looking for a restaurant in the cheap price range that serves Italian food.	find_restaurant
I am looking for a reasonably priced restaurant in the north part of town.	find_restaurant
I want a restaurant that serves international cuisine.	find_restaurant
I'm looking for a place to eat in the centre of town.	find_restaurant
Hi, can you recommend me a good Asian restaurant? Something not too expensive?	find_restaurant
Hello, I am looking for a restaurant in the centre of town that serves Indonesian food.	find_restaurant
Hi, I am looking for a place to eat in the centre of town.	find_restaurant
I am looking for an expensive place to dine in the centre of town.	find_restaurant
I am looking for a moderate priced Chinese food place.	find_restaurant
I'm looking for a chinese restaurant.	find_restaurant
I'd like to find information for the restaurant called The Missing Sock.	find_restaurant
a moderately priced restaurant in the north part of town?	find_restaurant
Please help me find somewhere to eat in the centre	find_restaurant
Hello. Can you help me find the address of an inexpensive restaurant in the south part of town?	find_restaurant
Are there any Indonesian restaurants in the centre?	find_restaurant
I would like a restaurant in the south part of town that serves christmas food	find_restaurant
malaysian food in the west part of town	find_restaurant
Hi, could you help me find a restaurant called ask.	find_restaurant
I am looking for a restaurant sitar tandoori. Can you give me more information?	find_restaurant
Hello, I am looking for a restaurant name taj tandoori.	find_restaurant
I am looking for information on a restaurant, the name of the place is ask. Can you tell me about it?	find_restaurant
I'm looking for a restaurant serving Irish food in any area.	find_restaurant
Yes, I need some help and information pertaining to a particular restaurant. The name of the restaurant is Sitar Tandoori. I'd like some information on the place if you can help.	find_restaurant
I'm looking for an expensive mediterranean restaurant.	find_restaurant
i am looking for a place to dine. The restaurant should serve chinese food and should be in the expensive price range.	find_restaurant
I'm looking for a cheap restaurant that serves portugese food.	find_restaurant
I'm looking for a restaurant called The Nirala. Can you tell me where it is?	find_restaurant
I want to find a restaurant in any area and serves spanish food. What is the phone number and address?	find_restaurant
I want to dine at a Chinese food place in the centre area.	find_restaurant
I'm looking for a restaurant called graffiti.	find_restaurant
I want to find a cheap restaurant in the north part of town.	find_restaurant
I would like a restaurant in the east part of town that serves indonesian food	find_restaurant
Please suggest me some moderately priced restaurant in the south.	find_restaurant
I want to find an expensive restaurant in the north part of town.	find_restaurant
Can you suggest any local restaurants in the centre that serve fusion food? Thanks.	find_restaurant
I want a moderate priced restaurant in the west part of town.	find_restaurant
I'm looking for an expensive restaurant in the centre of town.	find_restaurant
Would you be so kind as to help me find a place to dine later?	find_restaurant
I would like to book a meal at a chinese restaurant.	find_restaurant
I'm looking for a restaurant that serves Turkish food.	find_restaurant
Are there any places that serve Christmas food? I heard there might be something like that around here.	find_restaurant
I'll be in there next week and my friend told me about a restaurant called The Missing Sock. Could you tell me where they are located?	find_restaurant
I would like an expensive restaurant that serves vegetarian food	find_restaurant
I would like a moderately priced restaurant that serves creative food.	find_restaurant
I need to find a certain restaurant called the slug and lettuce.	find_restaurant
I'm looking for a particular restaurant called the Pizza Express	find_restaurant
Hi, I am looking for a high-end Cuban restaurant in Cambridge.	find_restaurant
I am looking for a restaurnt in the west end that isn't too high priced.	find_restaurant
I want a danish restaurant in the south.	find_restaurant
Can you help me find an Italian restaurant in the city center?	find_restaurant
I am looking for an expensive Italian restaurant.	find_restaurant
Hi there, can you help me find a good Chinese restaurant? I seriously need some egg rolls.	find_restaurant
I am looking for bistro food.	find_restaurant
Can you help me find an expensive Panasian restaurant, please?	find_restaurant
I am looking for an expensive restaurant that serves Welsh food.	find_restaurant
Hi, I am looking for information on a restaurant it's called saffron brasserie.	find_restaurant
A moderately priced restaurant in the east part of town	find_restaurant
Hi, I am trying to find a restaurant serving Italian cuisine, something expensive please. What would you suggest?	find_restaurant
I am looking for an expensive place to dine in the north.	find_restaurant
I am looking for a restaurant that serves asian oriental food in the centre of town.	find_restaurant
I'm looking for a place to dine in the centre of town that serves modern european food.	find_restaurant
Hi. Can you help me find a restaurant?	find_restaurant
I would like to find a cheap restaurant that serves tuscan food	find_restaurant
I'm looking for an expensive restaurant.	find_restaurant
I'm planning to visit Cambridge and would like to know the options available for upscale Chinese dining.	find_restaurant
Can you help me find some local restaurants to dine in during my visit to Cambridge?	find_restaurant
I would like an expensive restaurant in the south part of town	find_restaurant
Need a place to eat, panasian food, pricey!	find_restaurant
I need suggestions for a moderately priced restaurant in the center part of town. Can you help me?	find_restaurant
I'm looking for a restaurant in the east part of town that serves cantonese food.	find_restaurant
I am looking for a restaurant called Panahar.	find_restaurant
Hello! Are there any cheap restaurants in the centre?	find_restaurant
Hello I'd like to get some information on a place to eat in the north side of Cambridge.	find_restaurant
I would like a restaurant in the centre that is in the expensive price range.	find_restaurant
I need to find a place to eat and would prefer Indian food.	find_restaurant
I want an expensive restaurant and serves european food. What is the phone number?	find_restaurant
Hello, can you show me any moderately-priced restaurants in the Centre of town, please?	find_restaurant
Please find a cheap restaurant that serves Indian food.	find_restaurant
I would like to find an expensive place to eat please.	find_restaurant
I'm interested in finding a restaurant that serves Tuscan food. Do you know of any in the moderate price range?	find_restaurant
Hello, I'm looking for an Italian restaurant on the East side. Thank you!	find_restaurant
I would like a barbeque restaurant.	find_restaurant
I am coming to cambridge and would like to dine at a chinese restaurant.	find_restaurant
Is there any expensive restaurants in town serving Australian food?	find_restaurant
I really would like to try a japanese restaurant while in Cambridge.	find_restaurant
I am looking for a restaurant in the centre of town in the cheap price range.	find_restaurant
Hello, I am looking for a Scottish restaurant on the west side of town.	find_restaurant
I'm looking for something serving christmas food.	find_restaurant
Hi, I'm looking for an expensive restaurant that serves British cuisine.	find_restaurant
I need a vegetarian restaurant	find_restaurant
I am looking for a restaurant in the moderate price range in the centre of town.	find_restaurant
I'm looking for a restaurant in the centre of Cambridge which is pretty cheap in terms of prices.	find_restaurant
I am looking for a place for a restaurant called anatolia. Can you help me?	find_restaurant
I would like a cheap restaurant in the north part of town	find_restaurant
I have the name of a restaurant that I need some help finding, whenever you're ready.	find_restaurant
I'm looking for an upscale, expensive place to eat on the west side of town.	find_restaurant
I'm looking for a place to dine in the town centre, with an expensive price range.	find_restaurant
I'd really like to take my client out to a nice restaurant that serves indian food.	find_restaurant
I would like to find an expensive restaurant in the south part of town.	find_restaurant
Can you help me find somewhere to eat in the centre?	find_restaurant
I am looking for a cheap restaurant in the east part of town.	find_restaurant
Yes, I'd like some help looking for a particular restaurant. The name of the restaurant is Darrys Cookhouse and Wine Shop. I'd like to know where it's located and how expensive.	find_restaurant
I am looking to find a place to eat in Centre please.	find_restaurant
Can you find me a restaurant that is located in the centre and is in the moderate price range?	find_restaurant
I was wondering if you can help me find an expensive restaurant in the centre?	find_restaurant
I'm looking for an expensive Indian restaurant. Can you help me with that?	find_restaurant
I am looking for a restaurant in the south part of town that serves Portuguese food.	find_restaurant
is there a moderate priced restaurant?	find_restaurant
Hello, I am looking for an expensive restaurant, located in the centre.	find_restaurant
Where'a a restaurant on the east part f town?	find_restaurant
I am looking for a restaurant in the centre of town.	find_restaurant
I am looking for a Malaysian restaurant in the east part of town.	find_restaurant
I'm interested in a place called restaurant one seven. What can you tell me about it?	find_restaurant
Are there any Turkish restaurant in the Centre location?	find_restaurant
I'm looking for a restaurant named Panahar.	find_restaurant
I'm looking for an expensive restaurant that serves Indian food please.	find_restaurant
I need a place to eat? How about some place in the centre of the town and in moderate price range?	find_restaurant
I need to find an expensive place to eat.	find_restaurant
Can you direct me towards a moderately priced restaurant serving fusion food?	find_restaurant
I want your most expensive restaurant in the south town.	find_restaurant
I am looking for an affordable spanish restaurant.	find_restaurant
I need some help finding a place in Centre to eat, can you look it up for me?	find_restaurant
Is there a good restaurant on the north end of town?	find_restaurant
Hi, I need an expensive restaurant please.	find_restaurant
Hello there! I am looking for a restaurant that specializes in Swedish food.	find_restaurant
I'm looking for a modern european restaurant that had a moderate price range.	find_restaurant
Can you help me find some european food in Cambridge?	find_restaurant
I'm looking for something cheap in the south part of town.	find_restaurant
Hello. Can you please help me find a nice restaurant that serves Korean food? I need to know the address too.	find_restaurant
Hi there, I'm hungry. Please help me find a cheap place that serves the americas food	find_restaurant
I'm looking for information on a restaurant called mahal of cambridge.	find_restaurant
I haven't had German food in ages so please find me a place in the centre that serves it	find_restaurant
Can you help me find an expensive restaurant please?	find_restaurant
I need a restaurant that is in the expensive price range and that serves Indian food.	find_restaurant
Hello there, please find me a restaurant on the West side that serves scandinavian food	find_restaurant
I'm looking for a very nice place to dine. Something expensive.	find_restaurant
I am looking for a restaurant in the north part of town that serves brazilian food.	find_restaurant
What's a good mid price restaurant?	find_restaurant
looking for a restaurant in the expensive price range	find_restaurant
Can I have the contact information for the Fitzbillies Restaurant.	find_restaurant
Are there any Asian restaurants in the centre of town?	find_restaurant
Hello. Can you please recommend a Korean restaurant for me?	find_restaurant
Could you help me find a restaurant? I am looking for a place that serves quality Italian food an affordable price. I would greatly appreciate any help you can provide.	find_restaurant
Im up north, whats the address for a mediterranean place around here?	find_restaurant
Hi, could you tell me the phone number and address of the nearest Mexican restaurant?	find_restaurant
Hello I would like to find a restaurant in the west part of the city that costs a moderate amount.	find_restaurant
I'd like to find an expensive place to dine in the south.	find_restaurant
I want to go all out this St Patricks day, can you find me an Irish restaurant? Lets go with an expensive one.	find_restaurant
I'm looking for a place to dine. The restaurant should serve japanese food and should be in the centre.	find_restaurant
I want a moderately priced restaurant.	find_restaurant
I'm looking for an expensive vietnamese place to eat, can you help me find one?	find_restaurant
I am looking for a restaurant. The restaurant should be in the expensive price range and should be in the centre.	find_restaurant
I'd like to find a restaurant serving British food that's in the centre.	find_restaurant
Can you find an expensive restaurant that serves venetian food?	find_restaurant
I would like a restaurant in the south part of town that serves jamaican food	find_restaurant
Hello, I am looking for a restaurant on the south side of town that serves international food.	find_restaurant
Hi, I want to find a Chinese place to eat that's expensive.	find_restaurant
Is there any place that serves BBQ around here?	find_restaurant
I am looking for an expensive restaurant in the east part of town. I would like the name and phone number.	find_restaurant
I am looking for a restaurant that serves Irish food and is in the expensive price range.	find_restaurant
I'm looking for a place to dine that's in the cheap price range and that serves Indian food.	find_restaurant
Is there a restaurant on the North side of town?	find_restaurant
I want something in the north that serves moroccan food .	find_restaurant
I want to find a moderately-priced restaurant in the centre.	find_restaurant
I would like to find an Italian restaurant open for dinner?	find_restaurant
Hi I'm looking for a place to eat in the centre of town serving Indian food.	find_restaurant
I am looking for a restaurant that serves swedish food in the centre.	find_restaurant
Hi, I am traveling to Cambridge and am looking forward to trying some local restaurants. Can you help me with a great place to dine?	find_restaurant
Hi, I'm looking for a place with Tuscan food in any price range.	find_restaurant
I am looking for a place called tang chinese	find_restaurant
I want to find a cheap restaurant serving italian food. What is the address and phone number?	find_restaurant
Are there any expensive places to eat in the centre?	find_restaurant
I want an expensive restaurant in the east part of town. I would also like its phone number.	find_restaurant
I feel like trying Chinese today, find me a cheap place that serves it please	find_restaurant
I'm looking for a restaurant that offers British food in a moderate price range, can you help me with that?	find_restaurant
I need help finding a place that serves spanish food and is located in the centre, can you help me?	find_restaurant
I am looking for a restaurant that serves british food in cambridge in the moderate price range	find_restaurant
Can you assist me to find Restaurants in the Center of Cambridge that serves Chines foods?	find_restaurant
Hello, I am looking for a moderately priced restaurant that serves traditional food.	find_restaurant
Hi, I am looking for an expensive restaurant to dine at in the south.	find_restaurant
I'm looking for places to eat in the North part of town.	find_restaurant
Hi there, I'd like to find a good place to eat in the city centre tonight, but I'm looking for somewhere cheap. Have you any good recommendations?	find_restaurant
I would like a moderately priced restaurant in the south part of town	find_restaurant
I am looking for a cheap restaurant in the North part of town. I will need their address.	find_restaurant
im looking for a place to dine, it should be in the south serving morden global food	find_restaurant
Hello, I'd like some information on a restaurant today.	find_restaurant
I need the phone number to a restaurant located in the north part of town that is moderately priced, thank you	find_restaurant
I need an expensive restaurant	find_restaurant
I'm looking for a thai restaurant on the west side.	find_restaurant
I would really like to find a Basque restaurant on the west side. Does that exist?	find_restaurant
I need you to help me find an expensive restaurant to dine in, I'd like it to be chinese food.	find_restaurant
Could you help me find a place to dine on my trip?	find_restaurant
I want to find a cheap restaurant and serves australasian food.	find_restaurant
I'd like to find a restaurant that serves Korean food.	find_restaurant
I'd like to find an expensive place to dine that specifically serves italian food.	find_restaurant
I am hoping you can help me find a British restaurant at which to dine during my visit to Cambridge.	find_restaurant
I would like a cheap restaurant in the south part of town.	find_restaurant
I am looking for Irish food that is cheap. I will need their phone number too.	find_restaurant
I would like a restaurant in the north part of town that serves canapes food.	find_restaurant
I would like a a decent chinese restaurant	find_restaurant
I am looking for a cheap restaurant	find_restaurant
Will you help me find a portuguese restaurant in the east please?	find_restaurant
I am trying to find a Jamaican restaurant	find_restaurant
I am looking for a restaurant please.	find_restaurant
Hello, I am looking for a restaurant that serves international food.	find_restaurant
I was hoping that you could find a restaurant for me.	find_restaurant
I want to find a cheap Hungarian restaurant.	find_restaurant
I want something in the north part of town with swedish food.	find_restaurant
I am looking for an expensive restaurant that serves Thai food.	find_restaurant
Are there any crossover restaurants in the west?	find_restaurant
I am looking for a restaurant serving persian food.	find_restaurant
I am looking for an italian restaurant, cheap preferably.	find_restaurant
Hi, I need a really expensive restaurant.	find_restaurant
I'm looking for somewhere to eat in the west. Can you help me out?	find_restaurant
Hi I am looking for a cheap place to dine serving Italian food	find_restaurant
I need a place to eat that serves traditional food in the centre.	find_restaurant
I need a restaurant in the centre of town.	find_restaurant
I would like a moderately priced restaurant in the south part of town	find_restaurant
Can I get a cantonese restaurant?	find_restaurant
Could you recommend an expensive restaurant in the city centre?	find_restaurant
I'm looking for an expensive restaurant in the south.	find_restaurant
I am looking for a british restaurant please.	find_restaurant
Can you help me find a place to eat located in the centre that serves british food?	find_restaurant
Yes, I am looking for a place to eat. Can you help me?	find_restaurant
Hello! I'm looking for a restaurant that serves modern global food in the centre.	find_restaurant
I am looking for a nice restaurant in the center of town.	find_restaurant
Could you recommend a restaurant that serves french food? I'll need the address, phone number and postcode. Thank you.	find_restaurant
Hello, I'd like some information on a restaurant today.	find_restaurant
I am looking for the restaurant kymmoy.	find_restaurant
I'm looking for a moderately priced restaurant that serves chinese food.	find_restaurant
I am looking for some info on rice house restaurant.	find_restaurant
What restaurants are on the east part of town?	find_restaurant
Hello, I am looking for a restaurant by the name of Royal Standard. Do you know where it is?	find_restaurant
I'm looking for a restaurant that serves swiss food.	find_restaurant
Hi, I am looking for a restaurant called Yu garden.	find_restaurant
Can you help me find a Chinese restaurant please?	find_restaurant
I am looking for information about city stop restaurant?	find_restaurant
I want to find an expensive restaurant serving mediterranean food. What is the address and phone number?	find_restaurant
I need to find some information in a particular restaurant. Are you able to look up a specific place?	find_restaurant
Are there any good polish restaurants in the city?	find_restaurant
Hi is there any deals for tourists that will be a great price? so i can book them all at the same time?	find_restaurant
I need a place to eat in the cheap price range.	find_restaurant
I am looking for a restaurant serving modern american food in the moderate price range.	find_restaurant
I'm looking for a restaurant called Thanh Binh.	find_restaurant
I am interested in a restaurant located in the north part of town that specializes in Indonesian food, please.	find_restaurant
I need to find a moderately priced vegetarian restaurant.	find_restaurant
I'd like to find an expensive restaurant that serves venetian food.	find_restaurant
I would like a restaurant in the west part of town.	find_restaurant
I am looking for the price range of a restaurant called Rice boat.	find_restaurant
I'm looking for Scandinavian food in any area.	find_restaurant
