utts	labels
Guten Tag, I am staying overnight in Cambridge and need a place to sleep. I need free parking and internet.	find_hotel
Hi there! Can you give me some info on Cityroomz?	find_hotel
I am looking for a hotel named alyesbray lodge guest house.	find_hotel
I'm looking for a places to go and see during my upcoming trip to Cambridge.	find_hotel
I need a place to stay that has free wifi.	find_hotel
I am looking for a high priced hotel in the north side of town	find_hotel
I'm looking for a hotel, can you help?	find_hotel
I will be staying in Cambridge. I need a hotel with wifi.	find_hotel
I live in the centre of town and want to see if I can find a reasonable room for my parents to stay while they are visiting.	find_hotel
I would like to find a cheap hotel to stay at where there is free parking. Do you have any suggestions?	find_hotel
I am looking for a 4 star place to stay.	find_hotel
I would like to find out information about a hotel called Warkworth House.	find_hotel
I need a hotel with free wifi and free parking, thank you	find_hotel
I'm looking for a hotel that includes free wifi and free parking.	find_hotel
Can you help me find a place to stay that's four stars and has free wifi?	find_hotel
I don't know if this is possible but can you please get me some information on the alexander bed and breakfast?	find_hotel
Hello, I'm looking for a place to stay in town. I'd like a place with free parking and a 2 star rating, please.	find_hotel
Can you help me in finding a suitable guesthouse please?	find_hotel
Hi! Would you please help me find a hotel to stay at?	find_hotel
Could you help me find a 0 star hotel?	find_hotel
I'm looking for a hotel called Kirkwood House please.	find_hotel
Can you help me find a place to stay that is expensive and includes free parking?	find_hotel
I would like a guesthouse in the moderate price range. Do you think you could find one for me?	find_hotel
I am looking for a hotel that gives me free parking and free wifi.	find_hotel
I am looking for a place to stay. The hotel should include free wifi and should be in the type of hotel	find_hotel
Can you find me a 3 star hotel in the centre?	find_hotel
I need a three star hotel with internet. Can you help?	find_hotel
I'm looking for a hotel called city centre north b and b	find_hotel
I am look for a hotel near the beach near the main strip	find_hotel
I am looking for information about a hotel called the autumn house.	find_hotel
I am looking for a place to stay.	find_hotel
I'm looking for a cheap place to stay. Can you help?	find_hotel
I'm looking for a hotel, is that something you help with?	find_hotel
I need a list of cheap places to stay that include free parking.	find_hotel
I'm looking to get some info about a hotel called Home from Home	find_hotel
Hi, I need a hotel on the west side, please.	find_hotel
Hey, I need a place to stay with free wifi and free parking.	find_hotel
I am looking for a certain hotel. Could you see if you might have any info on it?	find_hotel
I am looking for a place to stay	find_hotel
Hi, I could use help with my planning. I am trying to find a place to stay.	find_hotel
I am looking for a place to stay. The hotel should be in the type of guesthouse and doesn't need to include internet	find_hotel
I am looking for Warkworth House hotel. Any information on it?	find_hotel
Hi, I need a place to stay with free wifi and in a moderate price range.	find_hotel
I am looking for a hotel in Cambridge.	find_hotel
Can you give me some information on the Avalon Hotel?	find_hotel
I am looking for the Limehouse hotel.	find_hotel
I need a cheap place to stay, what would you recommend?	find_hotel
Howdy, it would help me a great deal if you could please get me some information about the alexander bed and breakfast	find_hotel
Can you help me find somewhere to stay with free wifi?	find_hotel
Hi, I'm looking for a guesthouse. Do you know of any 4-star properties?	find_hotel
I need a place to stay in the north that includes free parking. What options are available?	find_hotel
I need a cheap, 2 star hotel to stay at here in Cambridge	find_hotel
I'm looking for a place to stay. I'd like a hotel, not a guesthouse, and I don't care about internet.	find_hotel
Hi there, I'm hoping you can help me find a hotel in the south of Cambridge.	find_hotel
I am looking for a cheap hotel that includes free parking.	find_hotel
I'm looking for a cheap hotel in the north.	find_hotel
I need some lodging accommodations. It needs to have free parking and Internet please!	find_hotel
I am looking for a guesthouse that has free parking.	find_hotel
I need a place to stay that doesn't have to have internet and is in the expensive price range please.	find_hotel
Can you find a 4 star hotel in the north side?	find_hotel
I need a moderately priced guest house.	find_hotel
I am looking for a place to stay with 4 stars.	find_hotel
Hi, I'm looking for a 4-star hotel with free wifi.	find_hotel
i need a place to stay	find_hotel
I need a place to stay that is cheap.	find_hotel
I'm looking for a hotel called hamilton lodge.	find_hotel
I'm looking for a moderately priced guest house. Can you recommend one?	find_hotel
I sure hope so. A friend recommended the Alexander Bed and Breakfast. What can you tell me about it?	find_hotel
I want to find a place to stay that is a guesthouse and has free parking.	find_hotel
Hi, I'm looking for a 1 star place to stay with free wifi.	find_hotel
Can you find me a hotel in the northern area that isn't to cheap or expensive?	find_hotel
Can you find me a guest house?	find_hotel
I am looking for a place to stay. The hotel should be in the type of guesthouse and should include free parking	find_hotel
Could you help me find a place to stay? I need a place in town that offers free parking and free wifi.	find_hotel
Hi. I'm looking for some moderately priced rooms for the night in the centre of town. Where can I go for that?	find_hotel
I am looking for a guesthouse that has free parking.	find_hotel
I am looking for a hotel that is in the expensive price range.	find_hotel
I'm looking for a hotel called the a and b guest house. Can you help me out?	find_hotel
I need a place to stay and I want it to be a guesthouse.	find_hotel
I'm looking for a moderately priced guesthouse for the night.	find_hotel
Can you help me find a place to stay that is moderately priced and includes free wifi?	find_hotel
I'm looking for a pleasant guesthouse to stay in. Would you be able to help me find one?	find_hotel
I am looking for a 3 star hotel to stay in.	find_hotel
I am looking for a place to stay that has free wifi.	find_hotel
I'm looking for a 2 star hotel in the north.	find_hotel
Are there good hotels that you can book?	find_hotel
I am looking for a hotel call arbury lodge guesthouse.	find_hotel
Yes, hopefully you can help with some information on a particular hotel?	find_hotel
I'm looking for a place to stay, I would prefer a hotel in the expensive price range.	find_hotel
Where do I get info on hotels?	find_hotel
Hi, I am looking for information on a place to stay.	find_hotel
I am looking for the gonville hotel. Can you help me?	find_hotel
Can you find a room available at a 4 star hotel with free wi-fi?	find_hotel
I will be going to Cambridge to do the tourist thing and would like a hotel in the moderate price range.	find_hotel
I am looking for a hotel with free parking in the North.	find_hotel
I am searching for a guesthouse in town that has free parking, do you know of any?	find_hotel
Hi, can you help me find a place to stay? I'd like a hotel on the north side, please.	find_hotel
I'm looking for a guesthouse that includes free parking.	find_hotel
Hi, can you help me find a place to stay on the north side?	find_hotel
I am looking for a place to stay. Can you help me out?	find_hotel
I'm looking for a 3-star lodging with free wifi.	find_hotel
I need a 5 star luxury hotel with a jacuzzi.	find_hotel
I'd like to find a moderately priced hotel with free wifi.	find_hotel
Can you tell me about a nice guest house in your city? I don't care how much it costs.	find_hotel
Can you help me find a guesthouse with free parking?	find_hotel
I need help finding a place to stay in the east.	find_hotel
Hi, I would like to book a 4 star guesthouse in Cambridge	find_hotel
I am looking for a hotel called The Cambridge Belfry. Can you help me with this?	find_hotel
Hey, I'd like to find a hotel in the north, today.	find_hotel
I am looking for a place to stay. in the west	find_hotel
I need to find information on home from home.	find_hotel
Hello! I'm looking for the hotel called Cityroomz. Can you give me some information, please?	find_hotel
Hi, I could use some help with information on places to stay.	find_hotel
I am looking for a room and want to see if I can find somewhere that has 3 stars. Can I get some help with that?	find_hotel
Can you help me with finding a hotel today, please?	find_hotel
I am looking for a place to stay. The hotel should be in the east and should include free wifi	find_hotel
I need a hotel with free parking, thanks!	find_hotel
Yes, could you please tell me about the Alpha-Milton guest house?	find_hotel
Are there any moderately priced hotels that have free parking, or do they all charge extra for that?	find_hotel
Could you help me find a 3 star guesthouse?	find_hotel
I need a guesthouse, with parking that is free.	find_hotel
I am looking for hotel with a star five rating and free wifi	find_hotel
I am looking for a place to stay.	find_hotel
I am looking to get some information on the acorn guest house.	find_hotel
I'm looking for a 2 star hotel.	find_hotel
I'm looking for a hotel with free parking, Please give me a 3 star guesthouse hotel	find_hotel
Could you help me find a place to stay on my upcoming trip?	find_hotel
Hi. I need to book a guesthouse that has free parking, can you help me?	find_hotel
Hello, I'm looking for a cheap place to stay with 4 stars.	find_hotel
Hi. Could you help me find a hotel for my trip?	find_hotel
I need a place to stay. Find me a hotel with free wifi.	find_hotel
I am looking for a 4 star hotel with free wifi.	find_hotel
I'm looking for an expensive guesthouse to say at.	find_hotel
I need to find a 4 star rated place to stay with free parking.	find_hotel
Hello! Can you please recommend a 3-star hotel?	find_hotel
Yes, I'm looking to stay at a guesthouse while I'm in town. I don't need internet access, so don't worry about that.	find_hotel
I need a place to stay in the east that has free wifi available.	find_hotel
Yes, I am looking for cheap lodging in town that includes free wifi.	find_hotel
Hi. I'm looking for a place to spend the night, and I want somewhere without any hidden fees for parking or wifi.	find_hotel
I am visiting and need a hotel in the north	find_hotel
Hi, I'm looking to book the Hamilton Lodge in Cambridge	find_hotel
I'm looking for a 4 star hotel.	find_hotel
I'm looking for a hotel that includes free wifi.	find_hotel
i need a place to stay	find_hotel
Hi, I'd like to find out more about any luxury hotels that have at least a 3-star rating.	find_hotel
I'm looking for a place to stay that includes free wifi and parking.	find_hotel
I need to find out information about a particular hotel called warkworth house	find_hotel
I need a place to stay in Cambridge. It should be either a hotel or guesthouse with 1 star and moderate price range. Can you help me with that?	find_hotel
I'd like some information on the Hamilton Lodge hotel, please.	find_hotel
I'm taking a trip in cambridge and need a place to stay. I would like a 4 star in the moderate price range.	find_hotel
I am looking for a 3 star hotel in the centre of town	find_hotel
Hello, I'd like to get some info one a hotel please.	find_hotel
I am looking for a guesthouse to stay at in the moderate price range.	find_hotel
Can you help me look up a particular hotel that I have in mind?	find_hotel
Can you help me find a nice hotel? I'd like to stay somewhere on the west side of town. A 0 star rating would be great, too.	find_hotel
Hello I need a place to stay in the centre please.	find_hotel
I am looking for some information on rosas's bed and breakfast.	find_hotel
i need a hotel with wifi in the north part of town	find_hotel
I'm looking for information on a hotel called hamilton lodge.	find_hotel
Hello, I'm looking for a hotel to stay in during my visit to Cambridge. Can you please help me find something in the moderate price range? No specific amenities needed.	find_hotel
Yes I would like information on the Cambridge Belfry.	find_hotel
I sure hope so. I'd like to find a place to stay, with four stars, in the north.	find_hotel
I am looking for a place to stay with free parking.	find_hotel
I'm looking for a place to stay in the north.	find_hotel
Hello, I'm looking for a place to stay on the north end. I'd like a place with free wifi.	find_hotel
I am hoping you might be able to help me find a place to stay last minute. I am on a bit of a budget so I need something moderate.	find_hotel
i need info about cityroomz	find_hotel
Hi, I am planning a trip and could use some advice on a place to stay.	find_hotel
I need a place to stay in the west of town.	find_hotel
i need a place to stay in Cambridge thats 4 star with free wifi	find_hotel
Hi I am looking for a moderate priced place to stay that has free wifi.	find_hotel
I need a hotel close to downtown Cambridge please.	find_hotel
I'm looking for a moderately priced hotel that offers free wifi. Do you have any of those?	find_hotel
Hi I am looking for some info on the Worth House hotel.	find_hotel
Need a place to stay, free wifi. Needs to be a hotel.	find_hotel
Can you help me find a hotel to stay in that includes free wifi and has a 4 star rating? Thanks!	find_hotel
I need a place to stay in the north in the moderate price range if you could help me.	find_hotel
I would like to book a hotel.	find_hotel
Could you help me find a 3 star hotel with free wifi in Cambridge?	find_hotel
I need a guesthouse rental that has free parking.	find_hotel
I am looking for a particular hotel. Its name is called autumn house	find_hotel
Please I need a place to Stay in Cambridge and I have the express by holiday inn Cambridge in mind. Can you help book that for me?	find_hotel
I am needing to find a place to stay while traveling in Cambridge. I would like a guesthouse that is 4 stars.	find_hotel
Hello, can you recommend a moderately-priced hotel in the North part of town, please?	find_hotel
Which hotels in Cambridge offer free wifi for guests?	find_hotel
I am looking for a guesthouse with free parking.	find_hotel
I'd like some information about the University Arms Hotel.	find_hotel
I need a place to stay in the expensive range.	find_hotel
Hey I'm looking for a hotel that has free parking, can you find one?	find_hotel
I'm looking for a place that offers free parking to it's guests. Got any hotels that offer that?	find_hotel
I need a guesthouse with free wifi.	find_hotel
I'm just looking for a place to sleep tonight in Cambridge.	find_hotel
I would like an inexpensive hotel on the west side of town.	find_hotel
I am looking for a hotel to stay at in Cambridge, at least a 4 star place please	find_hotel
i am looking for a place to stay. The hotel should have a star of 4 and should include free wifi.	find_hotel
Everyone keeps telling me I have to stay at Cityroomz when I visit next. Have you heard of it?	find_hotel
I need a hotel to stay with a 3 star rating please.	find_hotel
I'm looking for an expensive place to stay with free parking please.	find_hotel
I'm looking for a guesthouse with free parking, please.	find_hotel
I am looking for a hotel near the mall. The hotel should has free indoor parking, even it doesn't include internet.	find_hotel
Hi, I'm looking for a hotel that was recommended. It's called the Cambridge Belfry?	find_hotel
I'm planning my trip to Cambridge and am looking for a particular hotel.	find_hotel
There is a certain hotel I want to stay in, can you book that?	find_hotel
i need a place to stay	find_hotel
Would you be able to help me find a room that has free wifi?	find_hotel
Hi I need a hotel that is in the east. I don't need free parking.	find_hotel
I would like to stay in a hotel that is moderately priced and includes free parking. Can you help?	find_hotel
i need information of a hotel called allenbell.	find_hotel
I am excited to eat at some great restaurants during my visit. Can you help me find a guesthouse?	find_hotel
I am looking for a place to stay. The hotel should be in the type of guesthouse and should be in the cheap price range	find_hotel
I'm looking for a hotel with free wifi.	find_hotel
I am looking for a hotel with free wifi for when I am visiting Cambridge.	find_hotel
I need a place to stay in the north that has free wifi.	find_hotel
I need a hotel in the lower price range that includes free parking.	find_hotel
I need a palce to stay that has free wifi but in the moderate price range.	find_hotel
Are there any cheap hotels (not guesthouses) in town?	find_hotel
Good morning, I need a place to stay that has free wifi and that is in the expensive price range. Can you please tell me what is available?	find_hotel
Can you help me find a hotel today?	find_hotel
I'm looking for a moderate priced place to stay with free parking please.	find_hotel
I am going to be visiting and would like a guesthouse.	find_hotel
Could you help me find a hotel on the south side of town?	find_hotel
Hi, I'd like to find out about the Hobsons House hotel.	find_hotel
Can you help me find a place to stay?	find_hotel
I need a place to stay with a star rating of 0.	find_hotel
I'm looking for a hotel called a and b quest house.	find_hotel
I am looking for a hotel with free wifi.	find_hotel
Can you help me find a hotel with free parking?	find_hotel
I'm looking for a hotel with a 4 star rating to stay at and I don't need to have internet. Can you help?	find_hotel
I would like to find a guesthouse to stay in that's in the expensive price range. Can you help me?	find_hotel
Hi! Are there any guesthouses in town that have free parking?	find_hotel
Hello. I am coming into town and would like help finding a play to stay.	find_hotel
I am looking for a place to stay that is named aylesbray lodge guest house. Could you give me some information about it?	find_hotel
I need a place to stay in the west part of the town? Some place with free wifi please.	find_hotel
I am looking for a place to stay. The hotel should have a star of 4 and should be in the type of guesthouse	find_hotel
Can you help me find the a and b guest house hotel?	find_hotel
I need a place to stay. What's available on the west side, with free wifi?	find_hotel
Hi. I a looking for a cheap place to stay. What can you recommend for me?	find_hotel
Could you provide me with information about the Huntingdon Marriott hotel?	find_hotel
I want to book the el shaddai hotel.	find_hotel
Hi, I'd like a 3 star hotel please. And also internet!	find_hotel
I am looking for a place to stay. The hotel should be in the moderate price range	find_hotel
I am looking for a place to stay in the east.	find_hotel
Can you find me a place to say in the centre that includes free wifi?	find_hotel
Could you please find me a 4 star guesthouse	find_hotel
I need a cheap place to stay please.	find_hotel
I am looking for a guesthouse please.	find_hotel
Bonjour, I need a 4 star hotel with free internet, please.	find_hotel
Could you give me some information on a hotel named el shaddai?	find_hotel
Could you find me a room at a four star hotel that is kind of cheap?	find_hotel
Yes I am looking for a hotel that includes free wifi and has a three star rating please.	find_hotel
i am looking for a place to stay. The hotel should have a star of 4 and should be in the cheap price range.	find_hotel
i am looking for a particular hotel. Its name is called aylesbray lodge guest house.	find_hotel
I am looking for a place to stay.	find_hotel
I want to find an expensive hotel with a star of 4.	find_hotel
Hi! Can you help me find a hotel somewhere on the west side of town please?	find_hotel
I am looking for a place to stay with free wifi.	find_hotel
I need a room.	find_hotel
I'm looking to find lodging in a hotel in the expensive price range	find_hotel
I'm looking for a hotel named Worth House	find_hotel
I want to find a guesthouse place to stay with a 3 star rating.	find_hotel
I'm looking for a place to stay in the centre. It doesn't need to include internet.	find_hotel
I am visiting Cambridge and need a place to stay in the moderate range that has free internet.	find_hotel
Hello, I'm looking for a hotel that is cheap. It doesn't need to have free parking.	find_hotel
I am looking for a cheap place to stay in the east part of town.	find_hotel
Please suggest to me a 4 star motel in Cambridge that offer free wifi.	find_hotel
Hello, can you give me information about Express by Holiday Inn Cambridge, please?	find_hotel
I'm looking for a place to stay in west Cambridge.	find_hotel
How much for a room in a hotel in the city center?	find_hotel
Can you help me find a place to stay that is moderately priced and includes free parking?	find_hotel
Hi, I'm looking for the Bridge Guest House. Can you give the information about it please?	find_hotel
I am looking for a place to stay. The hotel should have a star of 3 and should be in the moderate price range	find_hotel
Hi, I'm looking for a guesthouse in the south part of town. Do you have anything in that category?	find_hotel
I'm looking for a place to stay in the city centre that has free parking.	find_hotel
Hi, can you help me find a 4 star guesthouse?	find_hotel
Hi, I am planning my upcoming trip and am looking for a place to stay. Can you recommend something for me?	find_hotel
Are there any available rooms in the Autumn House?	find_hotel
I'm looking for a hotel to stay in. I prefer something in the expensive price range, and also one that offers free parking.	find_hotel
I am looking for a place to stay, preferably a guesthouse.	find_hotel
Hello, is there any 4 star places to stay in the north?	find_hotel
I am looking for somewhere to stay in the east.	find_hotel
i am looking for a place to stay. The hotel should have a star of 4 and should include free parking.	find_hotel
Can you help me find information about a hotel called huntingdon marriott hotel?	find_hotel
What can you tell me about the El Shaddai?	find_hotel
I'm looking for a place to stay in Cambridge	find_hotel
I will be visiting Cambridge soon and need a place to stay. I am looking for a guesthouse with at least a star 3 rating.	find_hotel
Hello! I need a place to stay, can you help me find something in a moderate price range?	find_hotel
I am looking for a hotel by the name of home from home.	find_hotel
Can you help me find a place to stay that has free parking? It doesn't need to include internet.	find_hotel
Could you help me locate the Alpha Milton Guest House?	find_hotel
I want a hotel with free parking in the center of town.	find_hotel
I am looking for a place to stay and it doesn't need free parking , but I would like it to be cheap.	find_hotel
I would like to know more about Rosa's b&b	find_hotel
Do you have information about the Lovell Lodge?	find_hotel
I am looking for a place to stay with free wifi.	find_hotel
I need to find a place to stay in the moderate price range with free parking.	find_hotel
i am looking for a place to stay. The hotel should be in the type of guesthouse and should include free parking.	find_hotel
Is there a place to stay in the north area of town? Can it have free wifi access too?	find_hotel
Can you tell me about a particular hotel called the avalon?	find_hotel
Hi I am planning a trip and need to find a cheap place to stay in the west part of Cambridge.	find_hotel
I need information about places to stay that have a 4-star rating and offer free wifi.	find_hotel
I'm looking for a place called gonville hotel.	find_hotel
I'm so tired. Really need a place to lay my head for the nights. Can you find me some 3-star lodgings somewhere in the south?	find_hotel
yes you can help me I need to find a place to stay that includes free wifi and is in the moderate price range.	find_hotel
Hi, I need a place to stay. Something expensive on the north side.	find_hotel
I need to find a hotel with free wifi to stay at. Can you help me?	find_hotel
Hello any restaurants suggestions ? I am also looking for nice 4 star hotels with wifi.	find_hotel
Hi, I'm looking for a 4 star place that offers free wifi.	find_hotel
Are there any hotels where the wifi doesn't cost extra?	find_hotel
Hi there. I could use some help finding a place to stay that is 4 star rated.	find_hotel
I'm looking for a place to stay with free wifi. Can you help me find something moderately priced?	find_hotel
I need a particular hotel please.	find_hotel
Hello, I am looking for a guesthouse that includes free parking.	find_hotel
I am looking for a place to stay that has a 4 star rating in the east part of town.	find_hotel
I'm looking for a hotel called acorn guest house	find_hotel
I'm looking for some moderately priced accommodations for my visit. Can you help me with that?	find_hotel
I need a place to stay in the north please.	find_hotel
I would like to stay in a guesthouse that has free parking while I'm in Cambridge. Thanks.	find_hotel
Hello can you help me find a place to stay, such as a hotel? Also it needs to be at a reasonable price with free parking.	find_hotel
I am looking for a hotel tonight.	find_hotel
I am looking for a cheap hotel with free wifi	find_hotel
I would like to locate a particular hotel	find_hotel
Hi! I'm looking for a guesthouse.	find_hotel
Can you help me find a nice 4 star hotel?	find_hotel
Hi, I'm looking for a place to stay that has free parking.	find_hotel
Yes, Hi! I am looking for a hotel in the tampa bay area.	find_hotel
I need a place to stay that includes free parking and should be in the west please.	find_hotel
I'm looking to stay at a 4 star hotel that includes free parking.	find_hotel
